{
  "$schema": "https://example.invalid/trimui-launch-catalog-v1.schema.json",
  "format": "brickpro-launch-catalog",
  "schemaVersion": 1,
  "runners": [
    {
      "id": "generated-libretro",
      "version": "1.0.0",
      "kinds": ["libretro"],
      "capabilities": ["display-basic", "input-standard", "rumble", "suspend", "battery-saver"],
      "status": "approved"
    },
    {
      "id": "generated-portmaster",
      "version": "1.0.0",
      "kinds": ["portmaster"],
      "capabilities": ["display-basic", "input-standard", "suspend", "battery-saver"],
      "status": "approved"
    },
    {
      "id": "generated-standalone",
      "version": "1.0.0",
      "kinds": ["standalone"],
      "capabilities": ["display-basic", "input-standard", "suspend", "battery-saver"],
      "status": "approved"
    }
  ],
  "cores": [
    {
      "id": "generated-core",
      "version": "1.0.0",
      "runnerId": "generated-libretro",
      "runnerVersion": "1.0.0",
      "kind": "libretro",
      "status": "approved"
    }
  ],
  "profiles": [
    {
      "id": "default",
      "capabilities": ["display-basic", "input-standard", "rumble", "suspend", "battery-saver"]
    },
    {
      "id": "generated-default",
      "capabilities": ["display-basic", "input-standard", "rumble", "suspend", "battery-saver"]
    }
  ]
}
